{
  "page" : "undefined" ,
  "header" : "undefined" ,
  "footer" : "undefined" ,
  "body" : "undefined" ,
  "column1" : "undefined" ,
  "column2" : "undefined" ,
  "column3" : "undefined" ,
  "headline" : "undefined" ,
  "icon" : "undefined" ,
  "name" : "undefined" ,
  "description" : "Eloqua" ,
  "permissions" : "undefined" ,
  "folderId" : "undefined" ,
  "sourceTemplateId" : "undefined" ,
  "createdBy" : "undefined" ,
  "createdAt" : "undefined" ,
  "updatedBy" : "undefined" ,
  "updatedAt" : "undefined" ,
  "accessedAt" : "undefined" ,
  "scheduledFor" : "undefined" ,
  "depth" : "minimal"
}